{
  "$schema": "/design-system/schemas/token-catalog.schema.json",
  "schemaVersion": "1.0.0",
  "version": "0.3.0",
  "brandVersionId": "wonka-brand-v0.1.0",
  "source": "packages/tokens/src/wonka.tokens.json",
  "themes": [
    "light",
    "dark"
  ],
  "tokens": [
    {
      "id": "color.blue.100",
      "type": "color",
      "description": "Light blue wash for quiet branded surfaces.",
      "cssVariable": "--color-blue-100",
      "values": {
        "light": "#e7effd",
        "dark": "#e7effd"
      }
    },
    {
      "id": "color.blue.200",
      "type": "color",
      "description": null,
      "cssVariable": "--color-blue-200",
      "values": {
        "light": "#c9dafb",
        "dark": "#c9dafb"
      }
    },
    {
      "id": "color.blue.300",
      "type": "color",
      "description": null,
      "cssVariable": "--color-blue-300",
      "values": {
        "light": "#a9c3f8",
        "dark": "#a9c3f8"
      }
    },
    {
      "id": "color.blue.400",
      "type": "color",
      "description": "Primary luminous Wonka blue.",
      "cssVariable": "--color-blue-400",
      "values": {
        "light": "#75a3fd",
        "dark": "#75a3fd"
      }
    },
    {
      "id": "color.blue.500",
      "type": "color",
      "description": null,
      "cssVariable": "--color-blue-500",
      "values": {
        "light": "#4d86f5",
        "dark": "#4d86f5"
      }
    },
    {
      "id": "color.blue.600",
      "type": "color",
      "description": null,
      "cssVariable": "--color-blue-600",
      "values": {
        "light": "#2f6de0",
        "dark": "#2f6de0"
      }
    },
    {
      "id": "color.blue.700",
      "type": "color",
      "description": null,
      "cssVariable": "--color-blue-700",
      "values": {
        "light": "#1e54c2",
        "dark": "#1e54c2"
      }
    },
    {
      "id": "color.blue.800",
      "type": "color",
      "description": null,
      "cssVariable": "--color-blue-800",
      "values": {
        "light": "#123e9a",
        "dark": "#123e9a"
      }
    },
    {
      "id": "color.blue.900",
      "type": "color",
      "description": "Deep brand blue for high-contrast surfaces.",
      "cssVariable": "--color-blue-900",
      "values": {
        "light": "#082c72",
        "dark": "#082c72"
      }
    },
    {
      "id": "color.green.100",
      "type": "color",
      "description": null,
      "cssVariable": "--color-green-100",
      "values": {
        "light": "#eaf6ee",
        "dark": "#eaf6ee"
      }
    },
    {
      "id": "color.green.200",
      "type": "color",
      "description": null,
      "cssVariable": "--color-green-200",
      "values": {
        "light": "#d6f0dd",
        "dark": "#d6f0dd"
      }
    },
    {
      "id": "color.green.300",
      "type": "color",
      "description": null,
      "cssVariable": "--color-green-300",
      "values": {
        "light": "#bee6c4",
        "dark": "#bee6c4"
      }
    },
    {
      "id": "color.green.400",
      "type": "color",
      "description": null,
      "cssVariable": "--color-green-400",
      "values": {
        "light": "#9fd9ad",
        "dark": "#9fd9ad"
      }
    },
    {
      "id": "color.green.500",
      "type": "color",
      "description": null,
      "cssVariable": "--color-green-500",
      "values": {
        "light": "#7bcb93",
        "dark": "#7bcb93"
      }
    },
    {
      "id": "color.green.600",
      "type": "color",
      "description": null,
      "cssVariable": "--color-green-600",
      "values": {
        "light": "#57b87a",
        "dark": "#57b87a"
      }
    },
    {
      "id": "color.green.700",
      "type": "color",
      "description": null,
      "cssVariable": "--color-green-700",
      "values": {
        "light": "#3f9d64",
        "dark": "#3f9d64"
      }
    },
    {
      "id": "color.green.800",
      "type": "color",
      "description": null,
      "cssVariable": "--color-green-800",
      "values": {
        "light": "#2a6f4f",
        "dark": "#2a6f4f"
      }
    },
    {
      "id": "color.green.900",
      "type": "color",
      "description": "Deep green used for sovereign and secure product contexts.",
      "cssVariable": "--color-green-900",
      "values": {
        "light": "#173630",
        "dark": "#173630"
      }
    },
    {
      "id": "color.orange.300",
      "type": "color",
      "description": "Soft waiting-state background.",
      "cssVariable": "--color-orange-300",
      "values": {
        "light": "#fde6c1",
        "dark": "#fde6c1"
      }
    },
    {
      "id": "color.orange.900",
      "type": "color",
      "description": "Waiting and caution state foreground.",
      "cssVariable": "--color-orange-900",
      "values": {
        "light": "#e89c32",
        "dark": "#e89c32"
      }
    },
    {
      "id": "color.neutral.white",
      "type": "color",
      "description": null,
      "cssVariable": "--color-white",
      "values": {
        "light": "#ffffff",
        "dark": "#ffffff"
      }
    },
    {
      "id": "color.neutral.light-gray",
      "type": "color",
      "description": null,
      "cssVariable": "--color-light-gray",
      "values": {
        "light": "#f7f7f7",
        "dark": "#f7f7f7"
      }
    },
    {
      "id": "color.neutral.gray",
      "type": "color",
      "description": null,
      "cssVariable": "--color-gray",
      "values": {
        "light": "#f6f6f4",
        "dark": "#f6f6f4"
      }
    },
    {
      "id": "color.neutral.mid-gray",
      "type": "color",
      "description": null,
      "cssVariable": "--color-mid-gray",
      "values": {
        "light": "#f0eeea",
        "dark": "#f0eeea"
      }
    },
    {
      "id": "color.neutral.dark-gray",
      "type": "color",
      "description": null,
      "cssVariable": "--color-dark-gray",
      "values": {
        "light": "#d9d9d5",
        "dark": "#d9d9d5"
      }
    },
    {
      "id": "color.neutral.light-brown",
      "type": "color",
      "description": null,
      "cssVariable": "--color-light-brown",
      "values": {
        "light": "#76766b",
        "dark": "#76766b"
      }
    },
    {
      "id": "color.neutral.dark-brown",
      "type": "color",
      "description": null,
      "cssVariable": "--color-dark-brown",
      "values": {
        "light": "#3b2929",
        "dark": "#3b2929"
      }
    },
    {
      "id": "color.neutral.black",
      "type": "color",
      "description": "Wonka near-black with a green undertone.",
      "cssVariable": "--color-black",
      "values": {
        "light": "#0e1a16",
        "dark": "#0e1a16"
      }
    },
    {
      "id": "color.status.success",
      "type": "color",
      "description": "Solid success/confirmation state.",
      "cssVariable": "--color-status-success",
      "values": {
        "light": "#5eb064",
        "dark": "#5eb064"
      }
    },
    {
      "id": "color.status.success-surface",
      "type": "color",
      "description": "Light success wash for banners and toasts.",
      "cssVariable": "--color-status-success-surface",
      "values": {
        "light": "#edf7ef",
        "dark": "#edf7ef"
      }
    },
    {
      "id": "color.status.warning",
      "type": "color",
      "description": "Solid warning/caution state.",
      "cssVariable": "--color-status-warning",
      "values": {
        "light": "#e39938",
        "dark": "#e39938"
      }
    },
    {
      "id": "color.status.warning-surface",
      "type": "color",
      "description": "Light warning wash for banners and toasts.",
      "cssVariable": "--color-status-warning-surface",
      "values": {
        "light": "#fef8ec",
        "dark": "#fef8ec"
      }
    },
    {
      "id": "color.status.danger",
      "type": "color",
      "description": "Solid destructive/error state.",
      "cssVariable": "--color-status-danger",
      "values": {
        "light": "#df5c30",
        "dark": "#df5c30"
      }
    },
    {
      "id": "color.status.danger-surface",
      "type": "color",
      "description": "Light error wash for banners and toasts.",
      "cssVariable": "--color-status-danger-surface",
      "values": {
        "light": "#fbedea",
        "dark": "#fbedea"
      }
    },
    {
      "id": "color.status.info-surface",
      "type": "color",
      "description": "Light info wash for banners and toasts.",
      "cssVariable": "--color-status-info-surface",
      "values": {
        "light": "#e7efff",
        "dark": "#e7efff"
      }
    },
    {
      "id": "radius.xs",
      "type": "dimension",
      "description": "Compact callouts and utility controls.",
      "cssVariable": "--radius-xs",
      "values": {
        "light": "0.25rem",
        "dark": "0.25rem"
      }
    },
    {
      "id": "radius.sm",
      "type": "dimension",
      "description": "Default cards, panels, and banners.",
      "cssVariable": "--radius-sm",
      "values": {
        "light": "0.5rem",
        "dark": "0.5rem"
      }
    },
    {
      "id": "radius.md",
      "type": "dimension",
      "description": null,
      "cssVariable": "--radius-md",
      "values": {
        "light": "0.75rem",
        "dark": "0.75rem"
      }
    },
    {
      "id": "radius.lg",
      "type": "dimension",
      "description": null,
      "cssVariable": "--radius-lg",
      "values": {
        "light": "1rem",
        "dark": "1rem"
      }
    },
    {
      "id": "radius.button",
      "type": "dimension",
      "description": "Fallback radius for button hit areas; shaped variants use their SVG silhouette.",
      "cssVariable": "--radius-button",
      "values": {
        "light": "1rem",
        "dark": "1rem"
      }
    },
    {
      "id": "radius.full",
      "type": "dimension",
      "description": "Pills, chips, and avatars.",
      "cssVariable": "--radius-full",
      "values": {
        "light": "9999px",
        "dark": "9999px"
      }
    },
    {
      "id": "shadow.subtle",
      "type": "shadow",